{
  "id": "com.deskit.timestamp",
  "name": "timestamp",
  "displayName": {
    "en": "Timestamp Converter",
    "zh-CN": "时间戳转换"
  },
  "description": {
    "en": "Convert between Unix timestamps and readable dates from the launcher.",
    "zh-CN": "在启动器里转换 Unix 时间戳和可读日期。"
  },
  "author": "DesKit",
  "homepage": "https://github.com/WiIIiamWei/deskit-plugin-timestamp",
  "version": "0.3.1",
  "downloadUrl": "https://github.com/WiIIiamWei/deskit-plugin-timestamp/releases/download/v0.3.1/com.deskit.timestamp-0.3.1.deskit",
  "sha256": "b65eddc341bcaab1ff0835f432fea53cef06e24f55e387271970e054e1134b1b",
  "deskitEngine": "^0.2.0",
  "icon": "lucide:clock",
  "categories": [
    "utilities"
  ]
}
